{
  "schema_version": "1.0.0",
  "tenant_id": "researchops",
  "model_key": "model.researchops",
  "version": 1,
  "entities": [
    { "key": "service.researchops", "type": "service", "label": "ResearchOps", "position": 1 },

    { "key": "transaction.account-access", "type": "transaction", "label": "Access an account", "parent_key": "service.researchops", "position": 1 },
    { "key": "task.sign-in", "type": "task", "label": "Sign in", "parent_key": "transaction.account-access", "position": 1 },
    { "key": "step.identify-account", "type": "step", "label": "Identify account", "parent_key": "task.sign-in", "position": 1 },
    { "key": "question.sign-in-email", "type": "question", "label": "Sign-in email", "parent_key": "step.identify-account", "position": 1, "complexity": 2 },
    { "key": "field.sign-in-email", "type": "field", "label": "Sign-in email field", "parent_key": "question.sign-in-email", "position": 1, "required": true },
    { "key": "step.verify-account", "type": "step", "label": "Verify account", "parent_key": "task.sign-in", "position": 2 },
    { "key": "question.sign-in-code", "type": "question", "label": "One-time sign-in code", "parent_key": "step.verify-account", "position": 1, "complexity": 3 },
    { "key": "field.sign-in-code", "type": "field", "label": "One-time sign-in code field", "parent_key": "question.sign-in-code", "position": 1, "required": true },

    { "key": "transaction.project-navigation", "type": "transaction", "label": "Find and open a project", "parent_key": "service.researchops", "position": 2 },
    { "key": "task.find-project", "type": "task", "label": "Find a project", "parent_key": "transaction.project-navigation", "position": 1 },
    { "key": "step.open-projects", "type": "step", "label": "Open projects", "parent_key": "task.find-project", "position": 1 },
    { "key": "step.choose-project", "type": "step", "label": "Choose a project", "parent_key": "task.find-project", "position": 2 },
    { "key": "task.view-project-dashboard", "type": "task", "label": "View project dashboard", "parent_key": "transaction.project-navigation", "position": 2 },
    { "key": "step.review-project-dashboard", "type": "step", "label": "Review project dashboard", "parent_key": "task.view-project-dashboard", "position": 1 },

    { "key": "transaction.manage-project", "type": "transaction", "label": "Manage project information", "parent_key": "service.researchops", "position": 3 },
    { "key": "task.add-objective", "type": "task", "label": "Add project objective", "parent_key": "transaction.manage-project", "position": 1 },
    { "key": "step.describe-objective", "type": "step", "label": "Describe objective", "parent_key": "task.add-objective", "position": 1 },
    { "key": "question.objective", "type": "question", "label": "Project objective", "parent_key": "step.describe-objective", "position": 1, "complexity": 5 },
    { "key": "field.objective", "type": "field", "label": "Objective editor", "parent_key": "question.objective", "position": 1, "required": true },
    { "key": "task.add-stakeholder", "type": "task", "label": "Add stakeholder", "parent_key": "transaction.manage-project", "position": 2 },
    { "key": "step.describe-stakeholder", "type": "step", "label": "Describe stakeholder", "parent_key": "task.add-stakeholder", "position": 1 },
    { "key": "question.stakeholder-name", "type": "question", "label": "Stakeholder name", "parent_key": "step.describe-stakeholder", "position": 1, "complexity": 2 },
    { "key": "field.stakeholder-name", "type": "field", "label": "Stakeholder name field", "parent_key": "question.stakeholder-name", "position": 1, "required": true },
    { "key": "question.stakeholder-role", "type": "question", "label": "Stakeholder role", "parent_key": "step.describe-stakeholder", "position": 2, "complexity": 3 },
    { "key": "field.stakeholder-role", "type": "field", "label": "Stakeholder role field", "parent_key": "question.stakeholder-role", "position": 1, "required": true },
    { "key": "question.stakeholder-email", "type": "question", "label": "Stakeholder email address", "parent_key": "step.describe-stakeholder", "position": 3, "complexity": 2 },
    { "key": "field.stakeholder-email", "type": "field", "label": "Stakeholder email field", "parent_key": "question.stakeholder-email", "position": 1, "required": false },
    { "key": "task.add-user-group", "type": "task", "label": "Add user group", "parent_key": "transaction.manage-project", "position": 3 },
    { "key": "step.describe-user-group", "type": "step", "label": "Describe user group", "parent_key": "task.add-user-group", "position": 1 },
    { "key": "question.user-group-name", "type": "question", "label": "User group name", "parent_key": "step.describe-user-group", "position": 1, "complexity": 3 },
    { "key": "field.user-group-name", "type": "field", "label": "User group name field", "parent_key": "question.user-group-name", "position": 1, "required": true },

    { "key": "transaction.use-sourcebook", "type": "transaction", "label": "Use the Sourcebook", "parent_key": "service.researchops", "position": 4 },
    { "key": "task.browse-sourcebook", "type": "task", "label": "Browse Sourcebook pillars", "parent_key": "transaction.use-sourcebook", "position": 1 },
    { "key": "step.open-sourcebook", "type": "step", "label": "Open Sourcebook", "parent_key": "task.browse-sourcebook", "position": 1 },
    { "key": "step.choose-sourcebook-pillar", "type": "step", "label": "Choose Sourcebook pillar", "parent_key": "task.browse-sourcebook", "position": 2 },
    { "key": "task.read-sourcebook-pillar", "type": "task", "label": "Read Sourcebook pillar", "parent_key": "transaction.use-sourcebook", "position": 2 },
    { "key": "step.review-sourcebook-pillar", "type": "step", "label": "Review Sourcebook pillar", "parent_key": "task.read-sourcebook-pillar", "position": 1 }
  ],
  "outcomes": [
    { "key": "outcome.sign-in-code-requested", "label": "Sign-in code requested", "transaction_key": "transaction.account-access", "type": "progress" },
    { "key": "outcome.signed-in", "label": "Signed in", "transaction_key": "transaction.account-access", "type": "success" },
    { "key": "outcome.sign-in-failed", "label": "Sign-in verification failed", "transaction_key": "transaction.account-access", "type": "failure" },
    { "key": "outcome.project-opened", "label": "Project dashboard opened", "transaction_key": "transaction.project-navigation", "type": "success" },
    { "key": "outcome.objective-saved", "label": "Objective saved", "transaction_key": "transaction.manage-project", "type": "success" },
    { "key": "outcome.user-group-saved", "label": "User group saved", "transaction_key": "transaction.manage-project", "type": "success" },
    { "key": "outcome.sourcebook-pillar-opened", "label": "Sourcebook pillar opened", "transaction_key": "transaction.use-sourcebook", "type": "success" }
  ],
  "key_events": [
    { "key": "key-event.sign-in-code-requested", "label": "Sign-in code requested", "action": "auth.otp.requested", "element_key": "auth.otp", "outcome_key": "outcome.sign-in-code-requested" },
    { "key": "key-event.signed-in", "label": "Signed in", "action": "auth.otp.succeeded", "element_key": "auth.otp", "outcome_key": "outcome.signed-in" },
    { "key": "key-event.sign-in-failed", "label": "Sign-in verification failed", "action": "auth.otp.failed", "element_key": "auth.otp", "outcome_key": "outcome.sign-in-failed" },
    { "key": "key-event.project-opened", "label": "Project dashboard opened", "action": "page.loaded", "element_key": "page.project-dashboard", "outcome_key": "outcome.project-opened" },
    { "key": "key-event.objective-saved", "label": "Objective saved", "action": "flow.submit", "element_key": "form.project.add-objective", "outcome_key": "outcome.objective-saved" },
    { "key": "key-event.user-group-saved", "label": "User group saved", "action": "flow.submit", "element_key": "form.user-group.add", "outcome_key": "outcome.user-group-saved" },
    { "key": "key-event.sourcebook-environment-opened", "label": "Sourcebook environment opened", "action": "page.loaded", "element_key": "page.sourcebook-environment", "outcome_key": "outcome.sourcebook-pillar-opened" },
    { "key": "key-event.sourcebook-scope-opened", "label": "Sourcebook scope opened", "action": "page.loaded", "element_key": "page.sourcebook-scope", "outcome_key": "outcome.sourcebook-pillar-opened" },
    { "key": "key-event.sourcebook-people-opened", "label": "Sourcebook people opened", "action": "page.loaded", "element_key": "page.sourcebook-people", "outcome_key": "outcome.sourcebook-pillar-opened" },
    { "key": "key-event.sourcebook-context-opened", "label": "Sourcebook organisational context opened", "action": "page.loaded", "element_key": "page.sourcebook-organisational-context", "outcome_key": "outcome.sourcebook-pillar-opened" },
    { "key": "key-event.sourcebook-recruitment-opened", "label": "Sourcebook recruitment opened", "action": "page.loaded", "element_key": "page.sourcebook-recruitment-and-administration", "outcome_key": "outcome.sourcebook-pillar-opened" },
    { "key": "key-event.sourcebook-data-opened", "label": "Sourcebook data opened", "action": "page.loaded", "element_key": "page.sourcebook-data-and-knowledge-management", "outcome_key": "outcome.sourcebook-pillar-opened" },
    { "key": "key-event.sourcebook-governance-opened", "label": "Sourcebook governance opened", "action": "page.loaded", "element_key": "page.sourcebook-governance", "outcome_key": "outcome.sourcebook-pillar-opened" },
    { "key": "key-event.sourcebook-infrastructure-opened", "label": "Sourcebook tools and infrastructure opened", "action": "page.loaded", "element_key": "page.sourcebook-tools-and-infrastructure", "outcome_key": "outcome.sourcebook-pillar-opened" }
  ],
  "bindings": [
    { "element_key": "page.account.sign-in", "entity_key": "task.sign-in" },